{
  "id": "evvel_zaman_i_c_inde",
  "version": 1,
  "title": "Evvel Zaman İçinde",
  "duration": 174.545455,
  "clickDuration": 172.363636,
  "key": "D",
  "scale": "MINOR",
  "style": "MID",
  "tags": ["reaper-export"],
  "tempoMap": [
    { "time": 0, "measure": 1, "bpm": 110, "numerator": 4, "denominator": 4 }
  ],
  "sections": [
    { "name": "BOS", "start": 0, "end": 2.181818 },
    { "name": "INT", "start": 2.181818, "end": 10.909091 },
    { "name": "SAN", "start": 10.909091, "end": 32.727273 },
    { "name": "NAK", "start": 32.727273, "end": 50.181818 },
    { "name": "ARA", "start": 50.181818, "end": 58.909091 },
    { "name": "SAN", "start": 58.909091, "end": 80.727273 },
    { "name": "NAK", "start": 80.727273, "end": 98.181818 },
    { "name": "ARA", "start": 98.181818, "end": 115.636364 },
    { "name": "SAN", "start": 115.636364, "end": 137.454545 },
    { "name": "NAK", "start": 137.454545, "end": 154.909091 },
    { "name": "NAK", "start": 154.909091, "end": 174.545455 }
  ],
  "lyrics": [
    { "time": 10.909091, "end": 21.818182, "measure": 6, "beat": 1, "text": "EVVEL ZAMAN IÇINDE ATILLA BIR ÇOCUKTU\r\nROMA’YA KORKU SALDI KUDRETLI BIR HAN OLDU" },
    { "time": 21.818182, "end": 32.727273, "measure": 10, "beat": 4, "text": "ALPARSLAN ILK ÇAĞINDA KUTLU YOLA KOYULDU\r\nİMANIYLA YÜRÜDÜ, MALAZGIRT’TE YURT KURDU" },
    { "time": 32.727273, "end": 41.454545, "measure": 15, "beat": 4, "text": "ATA’N DA BIR ÇOCUKTU BUNU FARK ET\r\nSEN DE BÜYÜ YARINLARI INŞA ET" },
    { "time": 41.454545, "end": 50.181818, "measure": 19, "beat": 4, "text": "ZAFER YAZAR ALNINDA, KUDRET ASIL KANINDA\r\nATA’N SENIN YANINDA BUNU HISSET" },
    { "time": 58.909091, "end": 69.818182, "measure": 28, "beat": 1, "text": "EVVEL ZAMAN IÇINDE FATIH TEK DÜŞ KURARDI\r\nYIKTI BÜTÜN SURLARI, YAZDI BÜYÜK DESTANI" },
    { "time": 69.818182, "end": 80.727273, "measure": 32, "beat": 4, "text": "BÜTÜN KIZ ÇOCUKLARI TOMRIS’I TANIMALI\r\nORDULARI YÖNETTI DEĞIŞTIRDI YAZGIYI" },
    { "time": 80.727273, "end": 89.454545, "measure": 37, "beat": 4, "text": "ATA’N DA BIR ÇOCUKTU BUNU FARK ET\r\nSEN DE BÜYÜ YARINLARI INŞA ET" },
    { "time": 89.454545, "end": 98.181818, "measure": 41, "beat": 4, "text": "ZAFER YAZAR ALNINDA, KUDRET ASIL KANINDA\r\nATA’N SENIN YANINDA BUNU HISSET" },
    { "time": 115.636364, "end": 126.545455, "measure": 54, "beat": 1, "text": "EVVEL ZAMAN IÇINDE DOĞDU MUSTAFA KEMAL\r\nKARANLIK GÜNLERDE YAZDI AYDINLIK BIR MASAL" },
    { "time": 126.545455, "end": 137.454545, "measure": 59, "beat": 1, "text": "KÜLLERINDEN DOĞDU HALK, YÜKSELDI KUTLU VATAN\r\nEGEMENLIK MILLETIN, BAYRAM SIZE ARMAĞAN" },
    { "time": 137.454545, "end": 146.181818, "measure": 63, "beat": 4, "text": "ATA’N DA BIR ÇOCUKTU BUNU FARK ET\r\nSEN DE BÜYÜ YARINLARI INŞA ET" },
    { "time": 146.181818, "end": 154.909091, "measure": 68, "beat": 1, "text": "ZAFER YAZAR ALNINDA, KUDRET ASIL KANINDA\r\nATA’N SENIN YANINDA BUNU HISSET" },
    { "time": 154.909091, "end": 163.636364, "measure": 72, "beat": 1, "text": "ATA’N DA BIR ÇOCUKTU BUNU FARK ET\r\nSEN DE BÜYÜ YARINLARI INŞA ET" },
    { "time": 163.636364, "end": 174.545455, "measure": 76, "beat": 1, "text": "ZAFER YAZAR ALNINDA, KUDRET ASIL KANINDA\r\nATA’N SENIN YANINDA BUNU HISSET" }
  ],
  "chords": [],
  "assets": [
    { "id": "click", "kind": "audio", "path": "Click.flac", "hash": "sha256:pending", "audioRole": "click", "bus": "CUE", "label": "Click" },
    { "id": "lyrics", "kind": "lyrics", "path": "lyrics.json", "hash": "sha256:pending", "role": "vocal", "label": "Lyrics" }
  ]
}

